{
  "id": "ch_f6f6f6f6f6f6f6f6f6f6f6f6f6f6f6f6",
  "org_id": "org_example",
  "owner": "u_alex",
  "team_id": null,
  "world_id": "w_q4_plan",
  "source": {
    "kind": "upload",
    "id": "art_upload_rates",
    "version": 1
  },
  "label": "rates.xlsx",
  "position": 0,
  "text": "Item\tPrice\nWidget\t4.20",
  "text_sha256": "3f3f3f3f3f3f3f3f3f3f3f3f3f3f3f3f3f3f3f3f3f3f3f3f3f3f3f3f3f3f3f3f",
  "embed_profile": "embed-fake",
  "dimensions": 768,
  "screening": "clean",
  "created_at": "2026-10-16T03:00:01.000Z",
  "expires_at": null
}
